[
  {
    "timestamp": "2025-12-04T14:00:36.957986",
    "workorder_id": "WO-CONSOLIDATE-PLANNING-001",
    "feature_name": "consolidate-planning",
    "task_count": 4,
    "tasks": [
      {
        "content": "PHASE-1-001: [ ] Update CLAUDE.md Planning Workflow section",
        "activeForm": "PHASE-1-001: [ing ] Update CLAUDE.md Planning Workflow section",
        "status": "pending"
      },
      {
        "content": "PHASE-1-002: [ ] Update my-guide.md quick reference",
        "activeForm": "PHASE-1-002: [ing ] Update my-guide.md quick reference",
        "status": "pending"
      },
      {
        "content": "PHASE-2-001: [ ] Update index.html Planning section",
        "activeForm": "PHASE-2-001: [ing ] Update index.html Planning section",
        "status": "pending"
      },
      {
        "content": "PHASE-2-002: [ ] Update COMPREHENSIVE-review.md",
        "activeForm": "PHASE-2-002: [ing ] Update COMPREHENSIVE-review.md",
        "status": "pending"
      }
    ]
  }
]